<?xml version="1.0" encoding="UTF-8"?>
<tns:Configuration hierarchy="xk" description="Kosovo" xmlns:tns="http://www.example.org/Holiday"
  xmlns:xsi="http://www.w3.org/2001/XMLSchema-instance" xsi:schemaLocation="http://www.example.org/Holiday /Holiday.xsd">
  <tns:Holidays>
    <tns:Fixed month="JANUARY" day="1" descriptionPropertiesKey="NEW_YEAR" />

    <tns:Fixed month="FEBRUARY" day="15" descriptionPropertiesKey="DAY_OF_ASHKALI" />
    <tns:Fixed month="FEBRUARY" day="17" descriptionPropertiesKey="DECLARATION_OF_INDEPENDENCE_DAY" />

    <tns:Fixed month="MARCH" day="6" descriptionPropertiesKey="VETERANS_DAY" />
    <tns:Fixed month="MARCH" day="8" descriptionPropertiesKey="ROMA_DAY" />

    <tns:Fixed month="APRIL" day="23" descriptionPropertiesKey="DAY_OF_THE_TURKS" />

    <tns:Fixed month="MAY" day="1" descriptionPropertiesKey="LABOR_DAY" />
    <tns:Fixed month="MAY" day="6" descriptionPropertiesKey="DAY_OF_THE_GORANS" />
    <tns:Fixed month="MAY" day="9" descriptionPropertiesKey="EUROPE_DAY" />

    <tns:Fixed month="JUNE" day="12" descriptionPropertiesKey="DAY_OF_PEACE" />
    <tns:Fixed month="JUNE" day="15" descriptionPropertiesKey="CONSTITUTION_DAY" />

    <tns:Fixed month="SEPTEMBER" day="28" descriptionPropertiesKey="DAY_OF_BOSNIAKS" />

    <tns:Fixed month="NOVEMBER" day="28" descriptionPropertiesKey="DAY_OF_ALBANIANS" />

    <tns:Fixed month="DECEMBER" day="25" descriptionPropertiesKey="CHRISTMAS" />
  </tns:Holidays>
</tns:Configuration>
