<?xml version="1.0" encoding="UTF-8"?>
<tns:Configuration hierarchy="eg" description="Egypt" xmlns:tns="http://www.example.org/Holiday" xmlns:xsi="http://www.w3.org/2001/XMLSchema-instance" xsi:schemaLocation="http://www.example.org/Holiday/Holiday.xsd">
	<tns:Holidays>
		<tns:Fixed month="JANUARY" day="7" descriptionPropertiesKey="EGYPT_COPTIC_CHRISTMAS"/>
		<tns:Fixed month="JANUARY" day="25" descriptionPropertiesKey="EGYPT_25_JAN_REVOLUTION" validFrom="2012"/>
		<tns:Fixed month="APRIL" day="25" descriptionPropertiesKey="EGYPT_SINAI_LIBERATION"/>
		<tns:Fixed month="MAY" day="1" descriptionPropertiesKey="LABOUR_DAY"/>
		<tns:Fixed month="JUNE" day="30" descriptionPropertiesKey="EGYPT_30_JUNE_REVOLUTION" validFrom="2015"/>
		<tns:Fixed month="JULY" day="23" descriptionPropertiesKey="EGYPT_23_JULY_REVOLUTION"/>
		<tns:Fixed month="OCTOBER" day="6" descriptionPropertiesKey="EGYPT_ARMED_FORCES_DAY"/>
		<tns:ChristianHoliday type="EASTER_MONDAY" chronology="JULIAN"/>
		<tns:IslamicHoliday type="ID_AL_FITR"/>
		<tns:IslamicHoliday type="ID_AL_FITR_2"/>
		<tns:IslamicHoliday type="ID_AL_FITR_3"/>
		<tns:IslamicHoliday type="ARAFAAT"/>
		<tns:IslamicHoliday type="ID_UL_ADHA"/>
		<tns:IslamicHoliday type="ID_UL_ADHA_2"/>
		<tns:IslamicHoliday type="ID_UL_ADHA_3"/>
		<tns:IslamicHoliday type="NEWYEAR"/>
		<tns:IslamicHoliday type="MAWLID_AN_NABI"/>
	</tns:Holidays>
</tns:Configuration>
