<?xml version="1.0" encoding="UTF-8"?>
<tns:Configuration hierarchy="si" description="Slovenia"
	xmlns:tns="http://www.example.org/Holiday" xmlns:xsi="http://www.w3.org/2001/XMLSchema-instance"
	xsi:schemaLocation="http://www.example.org/Holiday /Holiday.xsd">
	<tns:Holidays>
		<tns:Fixed month="JANUARY" day="1" descriptionPropertiesKey="NEW_YEAR"/>
		<tns:Fixed month="JANUARY" day="2" validFrom="1955" validTo="2012" descriptionPropertiesKey="NEW_YEAR"/>
		<tns:Fixed month="FEBRUARY" day="8" descriptionPropertiesKey="PRESEREN"/>
		<tns:Fixed month="APRIL" day="23" descriptionPropertiesKey="ST_GEORGE" localizedType="UNOFFICIAL_HOLIDAY"/>
		<tns:Fixed month="APRIL" day="27" descriptionPropertiesKey="LIBERATION"/>
		<tns:Fixed month="MAY" day="1" descriptionPropertiesKey="LABOUR_DAY"/>
		<tns:Fixed month="MAY" day="2" descriptionPropertiesKey="LABOUR_DAY"/>
		<tns:Fixed month="JUNE" day="25" descriptionPropertiesKey="STATEHOOD"/>
		<tns:Fixed month="AUGUST" day="15" descriptionPropertiesKey="ASSUMPTION_DAY"/>
		<tns:Fixed month="OCTOBER" day="31" descriptionPropertiesKey="REFORMATION_DAY"/>
		<tns:Fixed month="NOVEMBER" day="1" descriptionPropertiesKey="ALL_SAINTS"/>
		<tns:Fixed month="NOVEMBER" day="11" descriptionPropertiesKey="ST_MARTIN" localizedType="UNOFFICIAL_HOLIDAY"/>
		<tns:Fixed month="DECEMBER" day="6" descriptionPropertiesKey="ST_NICHOLAS" />
		<tns:Fixed month="DECEMBER" day="25" descriptionPropertiesKey="CHRISTMAS"/>
		<tns:Fixed month="DECEMBER" day="26" descriptionPropertiesKey="INDEPENDENCE"/>
		<tns:ChristianHoliday type="EASTER" />
		<tns:ChristianHoliday type="EASTER_MONDAY" />
		<tns:ChristianHoliday type="CARNIVAL" localizedType="UNOFFICIAL_HOLIDAY"/>
		<tns:ChristianHoliday type="PENTECOST"/>
	</tns:Holidays>
</tns:Configuration>
