<?xml version="1.0" encoding="UTF-8"?>
<tns:Configuration hierarchy="al" description="Albania" xmlns:tns="http://www.example.org/Holiday" xmlns:xsi="http://www.w3.org/2001/XMLSchema-instance" xsi:schemaLocation="http://www.example.org/Holiday /Holiday.xsd">
  <tns:Holidays>
	  <tns:Fixed month="JANUARY" day="1"/>
	  <tns:Fixed month="JANUARY" day="4"/>
	  <tns:Fixed month="MARCH" day="15"/>
	  <tns:Fixed month="MAY" day="3"/>
	  <tns:Fixed month="OCTOBER" day="19"/>
	  <tns:Fixed month="NOVEMBER" day="28"/>
	  <tns:Fixed month="NOVEMBER" day="29"/>
	  <tns:Fixed month="DECEMBER" day="25" descriptionPropertiesKey="CHRISTMAS"/>
	  <tns:Fixed month="APRIL" day="5"/>
	  <tns:Fixed month="NOVEMBER" day="16"/>
	  <tns:Fixed month="SEPTEMBER" day="10"/>
  </tns:Holidays>
</tns:Configuration>
