<?xml version="1.0" encoding="UTF-8"?>
<tns:Configuration hierarchy="gb" description="United Kingdom"
	xmlns:tns="http://www.example.org/Holiday" xmlns:xsi="http://www.w3.org/2001/XMLSchema-instance"
	xsi:schemaLocation="http://www.example.org/Holiday /Holiday.xsd">
	<tns:Holidays>
		<tns:Fixed month="MAY" day="3" />
		<tns:Fixed month="MAY" day="31" />
		<tns:Fixed month="DECEMBER" day="27" />
		<tns:Fixed month="DECEMBER" day="28" />
		<tns:Fixed month="APRIL" day="2" />
	</tns:Holidays>
  <tns:SubConfigurations hierarchy="al" description="Alderney">
	<tns:Holidays>
  		<tns:Fixed month="JANUARY" day="1"/>
		<tns:Fixed month="APRIL" day="5" />
  	</tns:Holidays>
  </tns:SubConfigurations>
  <tns:SubConfigurations hierarchy="en" description="England">
	<tns:Holidays>
		<tns:Fixed month="JANUARY" day="1"/>
		<tns:Fixed month="AUGUST" day="30"/>
		<tns:Fixed month="APRIL" day="5" />
  	</tns:Holidays>
  </tns:SubConfigurations>
  <tns:SubConfigurations hierarchy="gu" description="Guernsey">
	<tns:Holidays>
  		<tns:Fixed month="JANUARY" day="1"/>
  		<tns:Fixed month="MAY" day="9"/>
		<tns:Fixed month="APRIL" day="5" />
  	</tns:Holidays>
  </tns:SubConfigurations>
  <tns:SubConfigurations hierarchy="im" description="Isle of Man">
	<tns:Holidays>
  		<tns:Fixed month="JANUARY" day="1"/>
  		<tns:Fixed month="JUNE" day="11"/>
  		<tns:Fixed month="JULY" day="5"/>
		<tns:Fixed month="APRIL" day="5" />
  	</tns:Holidays>
  </tns:SubConfigurations>
  <tns:SubConfigurations hierarchy="je" description="Jersey">
	<tns:Holidays>
  		<tns:Fixed month="JANUARY" day="1"/>
  		<tns:Fixed month="MAY" day="9"/>
		<tns:Fixed month="APRIL" day="5" />
  	</tns:Holidays>
  </tns:SubConfigurations>
  <tns:SubConfigurations hierarchy="ni" description="Northern Ireland">
	<tns:Holidays>
  		<tns:Fixed month="JANUARY" day="1"/>
		<tns:Fixed month="MARCH" day="17"/>
		<tns:Fixed month="JULY" day="12"/>
		<tns:Fixed month="APRIL" day="5" />
  	</tns:Holidays>
  </tns:SubConfigurations>
  <tns:SubConfigurations hierarchy="sc" description="Scotland">
	<tns:Holidays>
		<tns:Fixed month="JANUARY" day="1"/>
		<tns:Fixed month="JANUARY" day="4"/>
		<tns:Fixed month="AUGUST" day="2"/>
  	</tns:Holidays>
  </tns:SubConfigurations>
  <tns:SubConfigurations hierarchy="wa" description="Wales">
	<tns:Holidays>
		<tns:Fixed month="JANUARY" day="1"/>
		<tns:Fixed month="AUGUST" day="2"/>
		<tns:Fixed month="APRIL" day="5" />
  	</tns:Holidays>
  </tns:SubConfigurations>
</tns:Configuration>
